{
  "$schema": "https://json-schema.org/draft/2020-12/schema",
  "$id": "junie-protocol.schema.json",
  "title": "Junie wire vocabulary",
  "description": "Each table maps PascalCase identifiers to protocol values. Go constants and TypeScript keys derive from those identifiers. Every table requires at least one value. An empty table supplies no dispatch case and prevents the generator from checking coverage.",
  "type": "object",
  "additionalProperties": false,
  "required": [
    "_readme",
    "configIds",
    "modes",
    "defaultMode",
    "supplement",
    "terminalMeta",
    "outputReference",
    "outputFilePath"
  ],
  "$defs": {
    "table": {
      "type": "object",
      "minProperties": 1,
      "propertyNames": {
        "pattern": "^[A-Z][A-Za-z0-9]*$"
      },
      "additionalProperties": {
        "type": "string",
        "minLength": 1
      }
    },
    "unread": {
      "description": "This map states per-key reader exemptions. contractsAreConsumed.test.mjs checks each key on every declared reader side. A key that one side does not consume must state its reason here.",
      "type": "object",
      "minProperties": 1,
      "additionalProperties": {
        "type": "object",
        "minProperties": 1,
        "propertyNames": {
          "pattern": "^[A-Z][A-Za-z0-9]*$"
        },
        "additionalProperties": {
          "type": "object",
          "additionalProperties": false,
          "required": [
            "sides",
            "why"
          ],
          "properties": {
            "sides": {
              "type": "array",
              "minItems": 1,
              "uniqueItems": true,
              "items": {
                "enum": [
                  "go",
                  "ts"
                ]
              }
            },
            "why": {
              "type": "string",
              "minLength": 31
            }
          }
        }
      }
    }
  },
  "properties": {
    "configIds": {
      "$ref": "#/$defs/table"
    },
    "_readme": {
      "type": "string",
      "minLength": 1
    },
    "_unread": {
      "$ref": "#/$defs/unread"
    },
    "modes": {
      "$ref": "#/$defs/table"
    },
    "supplement": {
      "$ref": "#/$defs/table"
    },
    "terminalMeta": {
      "$ref": "#/$defs/table"
    },
    "outputReference": {
      "$ref": "#/$defs/table"
    },
    "defaultMode": {
      "description": "The key in `modes` a fresh Junie session runs on. A key, not a literal, so it cannot name a mode the table does not carry -- the generator checks the membership.",
      "type": "string",
      "pattern": "^[A-Z][A-Za-z0-9]*$"
    },
    "outputFilePath": {
      "$ref": "#/$defs/table"
    }
  }
}
